{"command_id":"cmd-2","session_id":"ses-2","ordinal":4,"command_state":"lost","final_event_sequence":8,"output_complete":false,"output_truncated":true,"output_unavailable_reason":"capture_boundary_unconfirmed","execution_target":{"kind":"remote","profile":"linux-host"},"authority":"remote","controller":{"controller_type":"mtls_principal","controller_id":"runner-client"},"observed_at":"2026-09-25T12:01:02Z","environment":"linux-dev","source":{"mode":"empty"},"capabilities":{"host_class":"Linux host","isolation":"os-user","effective_account":"ubuntu","service_limits":{}}}
