{"command_id":"cmd-1","session_id":"ses-1","ordinal":1,"command_state":"running","output_complete":false,"output_truncated":false,"execution_target":{"kind":"local","profile":"mac-workstation"},"authority":"local","controller":{"controller_type":"local_user","controller_id":"tomasz.walczuk"},"observed_at":"2026-09-25T12:00:01Z","environment":"mac-dev","source":{"mode":"empty"},"capabilities":{"host_class":"macOS workstation","isolation":"os-user","effective_account":"tomasz.walczuk","service_limits":{}}}
